id,creationdate,score,viewcount,title,answercount,commentcount,favoritecount,quest_name,quest_rep,ans_name,ans_rep
332289,2008-12-01 21:24:44,3184,5962784,How do I change the size of figures drawn with...,14,1,0.0,tatwright,37837.0,,
2051744,2010-01-12 19:31:47,420,587728,How to invert the x or y axis,10,3,0.0,DarkAnt,4211.0,Demitri,13369.0
2225995,2010-02-09 00:51:38,51,59922,How can I create stacked line graph?,4,0,0.0,David Underhill,15936.0,doug,69290.0
5486226,2011-03-30 12:26:50,7,6393,Rolling median in python,5,4,0.0,yueerhu,175.0,Mike Pennington,42288.0
5515021,2011-04-01 14:50:44,10,13744,Compute a compounded return series in Python,3,6,0.0,Jason Strimpel,14916.0,Mike Pennington,42288.0
